{
  "base_url": "http://127.0.0.1:8008",
  "user_id": "@agent_a:localhost",
  "password": "changeme",
  "device_id": "AGENTA",
  "gossip_room_alias": "#gossip:localhost",
  "log_dir": "logs",
  "log_redact": "none",
  "openclaw_url": "http://127.0.0.1:18789/wake",
  "openclaw_token": "changeme",
  "openclaw_timeout_ms": 5000,
  "openclaw_retry_max": 3,
  "openclaw_retry_delay_ms": 1000,
  "openclaw_queue_max": 100,
  "rate_limit_per_sec": 20,
  "dedupe_ttl_ms": 300000,
  "persist_access_token": false,
  "dm_recipient": "@agent_b:localhost",
  "dm_room_ids": ["!dm_room_id:localhost"],
  "dm_rooms": {
    "@agent_b:localhost": "!dm_room_id:localhost"
  },
  "goals": [
    "i want to buy a nintendo switch for 120â‚¬",
    "i want to trade a nintendo switch for pokemon cards"
  ]
}
